{
  "protocol_version": "0.1",
  "schema": "localize-anything-localization-brief-v1",
  "status": "draft",
  "document_type": "institutional_case_report",
  "source_genre": "chinese_application_summary",
  "target_mode": "external_publicity_practice_brief",
  "target_audience": [
    "overseas education institutions",
    "international cooperation partners",
    "enterprise partners"
  ],
  "style": {
    "formality": "high",
    "literalness": "medium_low",
    "publicity_tone": "restrained"
  },
  "allowed_transformations": [
    "split",
    "merge",
    "localized_rewrite",
    "explanatory_expansion",
    "structural_relocation"
  ],
  "forbidden_behaviors": [
    "unsupported_official_recognition",
    "invented_awards",
    "metric_boundary_change",
    "placeholder_loss",
    "markup_corruption",
    "silent_scope_expansion"
  ],
  "task_intent": {
    "scenario": "document_localization",
    "source_locale": "zh-CN",
    "target_locales": ["en-US"],
    "operating_mode": "greenfield_localization",
    "reference_policy": "style_only",
    "target_delivery_form": "reviewable_delivery_bundle",
    "requires_user_confirmation": true
  },
  "source_surface": {
    "project_path": "/example/project",
    "detected_project_type": "document",
    "primary_adapter": "core.word-document",
    "supported_file_count": 1,
    "selected_source_files": ["case-report.docx"],
    "adapter_counts": {
      "core.word-document": 1
    },
    "unprocessed_non_text_asset_count": 0
  },
  "strategy": {
    "workflow_depth": "standard",
    "preflight_mode": "auto",
    "privacy_mode": "standard",
    "data_classification": "internal",
    "style": {
      "formality": "high",
      "literalness": "medium_low",
      "publicity_tone": "restrained"
    },
    "allowed_transformations": [
      "split",
      "merge",
      "localized_rewrite",
      "explanatory_expansion",
      "structural_relocation"
    ],
    "forbidden_behaviors": [
      "unsupported_official_recognition",
      "invented_awards",
      "metric_boundary_change",
      "placeholder_loss",
      "markup_corruption",
      "silent_scope_expansion"
    ]
  },
  "constraints": {
    "do_not_invent_facts": true,
    "preserve_core_data": true,
    "preserve_placeholders": true,
    "preserve_markup": true,
    "flag_unconfirmed_names": true,
    "localize_policy_terms": true
  },
  "required_human_confirmations": [
    {
      "item": "task_intent",
      "reason": "runtime can infer a draft strategy but cannot accept task intent for the user",
      "status": "required"
    },
    {
      "item": "target_audience",
      "reason": "audience assumptions affect style, terminology, and acceptable transformations",
      "status": "required"
    },
    {
      "item": "claims_and_metrics",
      "reason": "document localization can change perceived facts, numbers, awards, or institutional claims",
      "status": "required"
    }
  ],
  "evidence": {
    "derived_from": ["inspect_project", "initialize_project"],
    "confidence": "deterministic_defaults",
    "limitations": [
      "brief is a deterministic draft and does not prove task intent has been accepted by the user",
      "semantic audience, claims, and terminology still require review before review_ready delivery"
    ]
  }
}
